{
  "type": "tree",
  "id": 0,
  "name": "",
  "length": 0.0,
  "children": [
    {
      "id": 1,
      "name": "A",
      "length": 0.096360892,
      "children": []
    },
    {
      "id": 2,
      "name": "0.989",
      "length": 0.159121648,
      "children": [
        {
          "id": 3,
          "name": "B",
          "length": 0.05,
          "children": []
        },
        {
          "id": 4,
          "name": "C",
          "length": 0.07,
          "children": []
        }
      ]
    }
  ]
}
